<?xml version="1.0" encoding="UTF-8"?>
<module name="module-param-default-types"
        xmlns="https://schemas.zernova.dev/module"
        xmlns:zernova="https://schemas.zernova.dev/core"
        xmlns:xsi="http://www.w3.org/2001/XMLSchema-instance"
        xsi:schemaLocation="
           https://schemas.zernova.dev/module https://schemas.zernova.dev/module/current/zernova-module.xsd
           https://schemas.zernova.dev/core https://schemas.zernova.dev/core/current/zernova.xsd">

    <operation name="integer-param-operation">
        <parameters>
            <parameter name="integerParam" type="number" defaultValue="11"/>
        </parameters>
        <body>
            <zernova:set-payload value="some value"/>
        </body>
        <output type="string"/>
    </operation>

    <operation name="boolean-param-operation">
        <parameters>
            <parameter name="booleanParam" type="boolean" defaultValue="false"/>
        </parameters>
        <body>
            <zernova:set-payload value="some value"/>
        </body>
        <output type="string"/>
    </operation>

    <operation name="date-param-operation">
        <parameters>
            <parameter name="dateParam" type="date" defaultValue="1959-09-07T00:00:00"/>
        </parameters>
        <body>
            <zernova:set-payload value="some value"/>
        </body>
        <output type="string"/>
    </operation>

    <operation name="datetime-param-operation">
        <parameters>
            <parameter name="datetimeParam" type="datetime" defaultValue="1959-09-07T00:00:00"/>
        </parameters>
        <body>
            <zernova:set-payload value="some value"/>
        </body>
        <output type="string"/>
    </operation>

    <operation name="string-param-operation">
        <parameters>
            <parameter name="stringParam" type="string" defaultValue="hello world"/>
        </parameters>
        <body>
            <zernova:set-payload value="some value"/>
        </body>
        <output type="string"/>
    </operation>

    <operation name="time-param-operation">
        <parameters>
            <parameter name="timeParam" type="time" defaultValue="1959-09-07T00:00:00"/>
        </parameters>
        <body>
            <zernova:set-payload value="some value"/>
        </body>
        <output type="string"/>
    </operation>

    <operation name="optional-parameter-operation">
        <parameters>
            <parameter name="optionalParameter" type="string" use="OPTIONAL"/>
        </parameters>
        <body>
            <zernova:set-payload value="some value"/>
        </body>
        <output type="string"/>
    </operation>
</module>
