<?xml version="1.0" encoding="UTF-8"?>
<module name="module-documentation"
        doc:description="Documentation for the connector"

        xmlns="https://schemas.zernova.dev/module"
        xmlns:zernova="https://schemas.zernova.dev/core"
        xmlns:doc="https://schemas.zernova.dev/documentation"
        xmlns:tns="https://schemas.zernova.dev/module-documentation"
        xmlns:xsi="http://www.w3.org/2001/XMLSchema-instance"
        xsi:schemaLocation="
           https://schemas.zernova.dev/module https://schemas.zernova.dev/module/current/zernova-module.xsd
           https://schemas.zernova.dev/core https://schemas.zernova.dev/core/current/zernova.xsd
           https://schemas.zernova.dev/module-documentation https://schemas.zernova.dev/module-documentation/current/zernova-module-documentation.xsd">

    <property name="aPropertyWithDoc" type="string" doc:description="Documentation for the property"/>
    <property name="aHiddenPropertyWithDoc" type="string" password="true" doc:description="Documentation for the hidden property"/>
    <property name="aPropertyDisplayModel" type="string" displayName="A pretty name property" summary="a summary tooltip property" example="SOME_PROPERTY_SAMPLE_DATA"/>
    <property name="aPropertyWithPlacement" type="string" order="42" tab="Not General Property"/>

    <operation name="operation-with-doc" doc:description="Documentation for the operation"
               displayName="A pretty name for the operation" summary="a summary tooltip operation" example="SOME_OPERATION_SAMPLE_DATA" >
        <parameters>
            <parameter name="paramWithDoc" type="string" doc:description="Documentation for the parameter" />
            <parameter name="hiddenParamWithDoc" type="string" password="true" doc:description="Documentation for the hidden parameter" />
            <parameter name="paramDisplayModel" type="string" displayName="A pretty name parameter" summary="a summary tooltip parameter" example="SOME_PARAMETER_SAMPLE_DATA"/>
            <parameter name="paramWithPlacement" type="string" order="17" tab="Not General Parameter"/>
        </parameters>
        <body>
            <zernova:set-payload value="hardcoded value"/>
            <tns:private-operation target="testingSyntheticParameter" someParameter="privateParameterValue"/>
        </body>
        <output type="string" doc:description="Documentation for the output"/>
        <output-attributes type="string" doc:description="Documentation for the output attributes"/>
        <errors>
            <error type="CUSTOM_ERROR_HERE"/>
            <error type="ANOTHER_CUSTOM_ERROR_HERE"/>
        </errors>
    </operation>

    <operation name="anotherOperationWithDoc" doc:description="Documentation for the operation"
               displayName="A pretty name for the operation" summary="a summary tooltip operation" example="SOME_OPERATION_SAMPLE_DATA" >
        <parameters>
            <parameter name="paramWithDoc" type="string" doc:description="Documentation for the parameter" />
            <parameter name="hiddenParamWithDoc" type="string" password="true" doc:description="Documentation for the hidden parameter" />
            <parameter name="paramDisplayModel" type="string" displayName="A pretty name parameter" summary="a summary tooltip parameter" example="SOME_PARAMETER_SAMPLE_DATA"/>
            <parameter name="paramWithPlacement" type="string" order="17" tab="Not General Parameter"/>
        </parameters>
        <body>
            <zernova:set-payload value="hardcoded value"/>
            <tns:private-operation target="testingSyntheticParameter" someParameter="privateParameterValue"/>
        </body>
        <output type="string" doc:description="Documentation for the output"/>
        <output-attributes type="string" doc:description="Documentation for the output attributes"/>
        <errors>
            <error type="CUSTOM_ERROR_HERE"/>
            <error type="ANOTHER_CUSTOM_ERROR_HERE"/>
        </errors>
    </operation>

    <operation name="private-operation" visibility="PRIVATE">
        <parameters>
            <parameter name="someParameter" type="string"/>
        </parameters>
        <body>
            <zernova:set-payload value="private operation"/>
        </body>
        <output type="number"/>
    </operation>
</module>
